{
  "artifact_sha256": "3333333333333333333333333333333333333333333333333333333333333333",
  "build_commit": "0000000000000000000000000000000000000000",
  "config_bundle_sha256": "2222222222222222222222222222222222222222222222222222222222222222",
  "contract_manifest_sha256": "1111111111111111111111111111111111111111111111111111111111111111",
  "emitted_at_us": 1786156800123456,
  "event_id": "evt_triad_task_status_event_v2",
  "event_kind": "TASK_STATUS_EVENT",
  "payload": {
    "acceptance_receipt_ids": [
      "acc-1"
    ],
    "actor": "x",
    "from_status": "IN_PROGRESS",
    "gate": "x",
    "predecessor_receipt_ids": [],
    "scope": {},
    "signature": "sig-1",
    "task_id": "x",
    "to_status": "PASS",
    "transitioned_at_us": 1786156800123456,
    "verification_receipt_ids": [
      "ver-1"
    ]
  },
  "producer_instance_id": "inst_golden_01",
  "producer_service": "governance-evidence",
  "schema": "triad.task_status_event.v2",
  "schema_version": "2.0.0"
}
